[
  {
    "impact_id": "impact-20260731-issue18-zerollama-adoption",
    "date": "2026-07-31",
    "type": "ADOPTION",
    "person_or_project": "@odilitime / zerollama",
    "contributors": [
      "@odilitime"
    ],
    "maintainers": [
      "@Blackwellboy"
    ],
    "credit_statement": "Adoption signal from zerollama doctor mapping; maintainer verified and closed issue.",
    "public_source": "https://github.com/Blackwellboy/model-serving-minefield/issues/18",
    "summary": "zerollama doctor maps Minefield traps; public thanks issue closed as completed adoption signal.",
    "minefield_role": "Trap catalog used by external doctor/tooling",
    "related_issue": "https://github.com/Blackwellboy/model-serving-minefield/issues/18",
    "related_traps": [],
    "evidence_status": "PUBLIC_PRIMARY",
    "permission_to_publish": "public_issue",
    "permission_to_quote": "public_issue_body_and_title",
    "wording_guardrail": "Do not invent user counts or saved-hours; cite the closed issue only.",
    "follow_up_state": "closed_completed",
    "source_state": "CLOSED_COMPLETED",
    "source_state_reason": "GitHub issue #18 closed as completed adoption thanks.",
    "last_verified": "2026-08-01"
  },
  {
    "impact_id": "impact-20260801-issue19-unvalidated-config-surface",
    "date": "2026-08-01",
    "type": "CONTRIBUTOR_DISCOVERY",
    "person_or_project": "@scottleimroth",
    "contributors": [
      "@scottleimroth"
    ],
    "maintainers": [
      "@Blackwellboy"
    ],
    "credit_statement": "Contributor measured the unvalidated config surface; maintainer provided diagnostic help and registry framing only.",
    "public_source": "https://github.com/Blackwellboy/model-serving-minefield/issues/19",
    "summary": "Contributor completed both halves of the control. Environment level: VLLM_FLASHINFER_MOE_BACKEND is unknown on vLLM 0.26 (absent from vllm.envs.environment_variables; validate_environ warns; serving path never reads it); absent/present log pair on vllm/vllm-openai:v0.26.0-aarch64-ubuntu2404. Engine level (2026-08-02): a real same-checkpoint engine init with the variable removed entirely (fresh docker rm -f + docker run, not a restart) still selected FLASHINFER_CUTLASS identically, with zero unknown-variable warnings; the variable is a no-op on this checkpoint/backend combo and --moe-backend is the actual engine control. Primary mitigation: --fail-on-environ-validation (default false) turns unknown VLLM_ vars into fail-fast startup errors. Same failure family as Trap 77 at the startup/configuration surface. Measured on this vLLM 0.26 build; not a general CUTLASS all-clear; no numbered trap assigned. Issue remains open pending trap promotion.",
    "minefield_role": "Intake document private evidence archive; trap number not yet assigned",
    "related_issue": "https://github.com/Blackwellboy/model-serving-minefield/issues/19",
    "related_traps": [
      "77"
    ],
    "evidence_status": "PUBLIC_PRIMARY",
    "permission_to_publish": "public_issue",
    "permission_to_quote": "public_issue_with_scope_guardrails",
    "wording_guardrail": "MEASURED_ON_THIS_BUILD (vLLM 0.26 / GB10 report). Env validation control COMPLETE; engine-selection control COMPLETE (2026-08-02, no-op scoped to this checkpoint/backend combo only). --fail-on-environ-validation is the recorded fail-fast mitigation; --moe-backend is the engine-level control. NOT a general CUTLASS all-clear. Do not publish ~70 tok/s without n=1 and reasoning-token caveats. Contributor credit required; maintainer diagnostic role must not replace contributor credit. No numbered trap assigned.",
    "follow_up_state": "env_and_engine_control_complete_trap_promotion_pending",
    "source_state": "OPEN",
    "source_state_reason": "GitHub issue #19 remains open; environment-level and engine-level controls both complete but trap promotion unresolved; no numbered trap assigned.",
    "last_verified": "2026-08-03"
  }
]
